科目名,年度,クォーター,時間割コード,テーマ
現代ＩＴ入門Ａ,2017,第3クォーター,3H065,"情報技術(Information Technology,IT)は我々の身の回り、産業、社会など様々な分野に急速に浸透してきている。急速に発達する技術が我々の生活にも大きな変革を及ぼそうとしているのである。　ここでは、①我々が日常的に接しているデジタル情報の基本的な構造の理解と②最新のITのトピックについての理解の２つを目標としている。最新トピックは、VRやAI、IoTなどを予定している。　(A)では、テキスト、画像のデジタルデータの実際を紹介し、VRなどの映像系の最新技術に触れる。　((B)では、音声の世界に触れて、AIやIoTにまつわる現状を紹介する。)"
音楽文化史１,2017,第3クォーター,3H086,エポックメーキングと評されてきた音楽作品、作曲家などを踏まえつつ、音楽芸術の表現様式の変遷とその社会的、文化史的な意味を考察する。
発達心理学（中・高）１,2017,第3クォーター,3H090,本授業は、人間の心の働きの発達をさまざまな観点から学習するものである。発達の各時期の発達課題等を理解し、青年期を含む生涯発達の様相と支援についての理解を深めるものである。
乳児心理学演習,2017,第3クォーター,3H117,乳児期の発達に関する研究知見を理解して，興味深い乳児の世界を想像するとともに，人間の心の成り立ちについて学ぶ。
現代ＩＴ入門Ｂ,2017,第4クォーター,4H065,"情報技術(Information Technology,IT)は我々の身の回り、産業、社会など様々な分野に急速に浸透してきている。急速に発達する技術が我々の生活にも大きな変革を及ぼそうとしているのである。　ここでは、①我々が日常的に接しているデジタル情報の基本的な構造の理解と②最新のITのトピックについての理解の２つを目標としている。最新トピックは、VRやAI、IoTなどを予定している。　(B)では、音声の世界に触れて、AIやIoTにまつわる現状を紹介する。　((A)では、テキスト、画像のデジタルデータの実際を紹介し、VRなどの映像系の最新技術に触れる。)"
音楽文化史２,2017,第4クォーター,4H086,エポックメーキングな個々の音楽作品を踏まえつつ、音楽芸術の表現様式の変遷とその社会的、文化史的な意味を考察する。
発達心理学（中・高）２,2017,第4クォーター,4H090,本授業は、人間の心の働きの発達をさまざまな観点から学習するものである。発達の各時期の発達課題等を理解し、青年期を含む生涯発達の様相と支援についての理解を深めるものである。
国際コミュニケーション演習Ａ,2017,第1クォーター,1H043,グローバル問題とアフリカのスタディズ
グローバル・ヒストリーＡ,2017,第1クォーター,1H052,アメリカ合衆国のユナイテッド・フルーツ社という巨大多国籍企業の歴史的動向に注目しながら、国際的なバナナ生産業の拡大およびバナナ食文化の普及と政治・社会問題の密接な関係について分析・検討する。
経済学,2017,第1クォーター,1H096,本講義では、我々を取り巻く資本主義経済の仕組みや構造について、適宜身近な生活やその時々話題になっている経済トピックを紹介しながら講義を行う。現代の経済現象や経済政策を理解するために必要な経済に関する理論や考え方を学習する。
乳幼児心理学１,2017,第1クォーター,1H113,教師が幼児の指導を行う上で、幼児の発達プロセスや学びのありようを理解することは重要である。本講義では、幼児の発達に関する基礎的な知識を学び、子どもを発達的に理解するための実践的力量を養成する。
国際コミュニケーション演習Ｂ,2017,第2クォーター,2H043,グローバル問題とアフリカのスタディズ
グローバル・ヒストリーＢ,2017,第2クォーター,2H052,この授業では、長期的に展開してきたグローバル化をめぐる諸問題を「歴史で」考える。また広義の近代の成立・変容を世界史的観点からとらえる見方が必要であるが、そこでの「世界史」とはどこを指すのか？にも注意を向けてもらいたい。この授業で扱う地域や個々の事例の多くは高校の歴史教育の場で体系的には学ぶ機会のなかった東南アジアや東・北アジア地域となる。日本への言及もこれらの地域の関係性のなかでとらえかえしていく。
政治学,2017,第2クォーター,2H097,「国家」を題材に取り上げ、西洋政治理論における議論と現代世界における実態、特にアジア、アフリカなどの現状とを比較する中で、秩序のあり方、民主主義のとらえ方、そして規範の背後にある価値規定などについて検討する。
乳幼児心理学２,2017,第2クォーター,2H113,教師が幼児の指導を行う上で、幼児の発達プロセスや学びのありようを理解することは重要である。本講義では、従来の発達理論や最新の発達研究の知見も取り入れながら、幼児のさまざまな活動や領域の発達について学び、発達をふまえた保育を考える基礎的・実践的力量を養成する。
グローバル共生社会論,2017,第4クォーター,4H039,本講義では、21世紀社会における「グローバルイシュー」解決への視座を養うために、地球規模（グローバル）の人類の営みについて、空間的広がりだけでなく歴史・時間軸という視座も取り入れながら考察する。人類の営みは歴史的に、生産力や科学技術の発展が起こると、それに呼応する形で社会制度や人間のあり方の変化が生じ、そうして変革された社会制度や人間が、さらに生産力や科学技術の高度化を進める・・・という科学技術（自然科学や工学などの学問対象）と社会制度・人間のあり方（社会科学や人文科学の学問対象）の相互作用の営みを普遍的に繰り返しながら今日まで発展してきた。本講義は、そのような人類史の中で、私たちの生きる今日の時代がどのような位置にあるのかを多様な学問分野から考察し、私たちが地球人類として今後どのような方向性で社会の開発や発展を模索すればよいのかを考えてみたい。
国際コミュニケーション演習Ａ,2017,第1クォーター,1H044,グローバル問題とアフリカのスタディズ
国際コミュニケーション演習Ａ,2017,第1クォーター,1H045,"International Communication I (Spring Semester)Through this course, students will develop their abilities to communicate in English on various topics wich students get easily interested in."
現代社会理論Ａ,2017,第1クォーター,1H062,貧困の共有という事態は、人類の長い歴史において、共同性の基礎にあるものだった。近代後の個人化の過程は、貧困の忘却とともに進展し、現代の私たちの自己認識や社会のありようを帰結している。この授業では、「貧しさ」「私らしさ」をキーワードとして、近現代の時空間についての認識を深めたいと思う。
ソーシャルエンパワメント論,2017,第2クォーター,2H036,現代社会のさまざまな課題の解決の過程において当事者性の高いコミュニティおよび当事者の果たす役割は大きい。本講義を通して、当事者性の高いコミュニティおよび当事者の主体的参加・参画（エンパワメント）をめぐる問題を多領域横断的に理解するとともに、その支援の方法論について考究する。
国際コミュニケーション演習Ｂ,2017,第2クォーター,2H044,グローバル問題とアフリカのスタディズ
国際コミュニケーション演習Ｂ,2017,第2クォーター,2H045,"International Communication I (Spring Semester)Through this course, students will develop their abilities to communicate in English on various topics wich students get easily interested in."
現代社会理論Ｂ,2017,第2クォーター,2H062,貧困の共有という事態は、人類の長い歴史において、共同性の基礎にあるものだった。近代後の個人化の過程は、貧困の忘却とともに進展し、現代の私たちの自己認識や社会のありようを帰結している。この授業では、「貧しさ」「私らしさ」をキーワードとして、近現代の時空間についての認識を深めたいと思う。
ＴＯＥＦＬ演習Ａ,2017,第3クォーター,3H040,"Language is part of culture, and it consists of much more than putting words into sentences. Culture determines habits of mind, how people interact with each other, what kinds of things they talk about or don’t talk about, and how they talk about them. Implicit in the TOEFL test is a cultural bias. The people who write the tests and determine how you should be graded have minds trained by Western culture. This means that, whether they are thinking about it or not, they are looking for answers that conform to a kind of Aristotelian logic that in its simpler modern form is known as critical thinking. In other words, they assume that conversing well means speaking clearly, addressing questions directly, and giving clear support showing that your viewpoint is valid. They assume that writing well means answering the question directly and supporting what you say with facts and reasons. Your score is based in part on how you put English words into English sentences, but also on the logic, the"
国際関係論Ａ,2017,第3クォーター,3H060,冷戦構造の崩壊とグローバリゼーションの進展の下、国際社会の構造にも大きな変化が生じてきている。たとえば民族や宗教の相違を背景とした対立、移民・難民の増加とそれに伴う摩擦の深刻化、他方で国家の枠をこえた地域統合の進展が各地で進んでいる。Aでは、現代国際関係の主要課題を理解する視座を、とくに文化の視点から掘り下げる。外交手法や国家の役割の変化、そして文化が国際社会の橋渡しとともに摩擦要因ともなってきている背景について、理解を深める。
非言語コミュニケーション論１,2017,第3クォーター,3H064,共感や思いやりが社会生活において大切であることには皆さん気づかれていることと思います。それでは、私たちはどのようにして他者の心を理解しているのでしょうか。実は、非言語コミュニケーションが非常に大きな役割を果たしています。面と向かって話していると、電話やメール以上に相手の気持ちが伝わってくるでしょう。私たちは、言語以外を使ってさまざまあ情報を伝え合っているのです。この授業では、ヒト・ヒト幼児・ヒト以外の動物がどのように他者と意思疎通をおこない、感情を理解し、共同生活を営み、社会や文化を形成しているかについてお話します。
心の発達と教育１,2017,第3クォーター,3H091,教師をはじめ子どもの育ちに関わる職業に必要とされる諸知識について，教育心理学の観点から学びます。
発達心理学（幼・小）１,2017,第3クォーター,3H107,本授業は、人間の心の働きの発達をさまざまな観点から学習するものである。発達の各時期の発達課題等を理解し、幼児期から児童期を含む生涯発達の様相と支援についての理解を深めるものである。
ＴＯＥＦＬ演習Ｂ,2017,第4クォーター,4H040,"Language is part of culture, and it consists of much more than putting words into sentences. Culture determines habits of mind, how people interact with each other, what kinds of things they talk about or don’t talk about, and how they talk about them. Implicit in the TOEFL test is a cultural bias. The people who write the tests and determine how you should be graded have minds trained by Western culture. This means that, whether they are thinking about it or not, they are looking for answers that conform to a kind of Aristotelian logic that in its simpler modern form is known as critical thinking. In other words, they assume that conversing well means speaking clearly, addressing questions directly, and giving clear support showing that your viewpoint is valid. They assume that writing well means answering the question directly and supporting what you say with facts and reasons. Your score is based in part on how you put English words into English sentences, but also on the logic, the"
国際関係論Ｂ,2017,第4クォーター,4H060,冷戦構造の崩壊とグローバリゼーションの進展の下、国際社会の構造にも大きな変化が生じてきている。たとえば民族や宗教の相違を背景とした対立、移民・難民の増加とそれに伴う摩擦の深刻化、他方で国家の枠をこえた地域統合の進展が各地で進んでいる。Aでは、現代国際関係の主要課題を理解する視座を、とくに文化の視点から掘り下げる。外交手法や国家の役割の変化、そして文化が国際社会の橋渡しとともに摩擦要因ともなってきている背景について、理解を深める。
非言語コミュニケーション論２,2017,第4クォーター,4H064,共感や思いやりが社会生活において大切であることには皆さん気づかれていることと思います。それでは、私たちはどのようにして他者の心を理解しているのでしょうか。実は、非言語コミュニケーションが非常に大きな役割を果たしています。面と向かって話していると、電話やメール以上に相手の気持ちが伝わってくるでしょう。私たちは、言語以外を使ってさまざまあ情報を伝え合っているのです。この授業では、ヒト・ヒト幼児・ヒト以外の動物がどのように他者と意思疎通をおこない、感情を理解し、共同生活を営み、社会や文化を形成しているかについてお話します。
エスノミュージコロジー２,2017,第4クォーター,4H087,本講義では、視聴覚資料を活用して世界の諸民族の音楽文化を概観してゆくなかで、実は私たちにも身近な問題を提供している民族音楽学の様々なトピックに触れてゆく。そして、近代西洋とは異なる価値体系をもつ音楽世界の多様さを理解し、「異文化を理解する」ということを通して最終的に「自分自身の再発見」へと繋げてゆくことを目指している。
心の発達と教育２,2017,第4クォーター,4H091,教師をはじめ子どもの育ちに関わる職業に必要とされる諸知識について，教育心理学の観点から学びます。
発達心理学（幼・小）２,2017,第4クォーター,4H107,本授業は、人間の心の働きの発達をさまざまな観点から学習するものである。発達の各時期の発達課題等を理解し、幼児期から児童期を含む生涯発達の様相と支援についての理解を深めるものである。
情報リテラシー演習１,2017,第3クォーター,3H037,オンラインコミュニケーション・文書処理・表計算関わる基本的な操作方法を身に付け、情報機器の具体的な活用技能を演習で習得していく。
社会教育計画論１,2017,第3クォーター,3H080,教育についての固定観念を揺るがし、学校教育を相対化させる社会教育に関心を寄せる。その上で、社会教育計画のトピックを提示する。
運動とこころの科学１,2017,第3クォーター,3H085,欧米での、運動やスポーツに関する心理学の名称は「Exercise and Sport Psychology」で、一般人の健康スポーツを対象とした運動心理学と競技スポーツを対象としたスポーツ心理学を区別している。また学校体育の問題を扱う体育心理学、身体動作の習得や表現をテーマにした運動学習など、その内容は多岐に渡っている。そこで本講義では狭義の運動心理学だけではなく、幅広く「運動することと心の関係」について様々なテーマから解説する。単に運動やスポーツに関することだけでなく、人間を理解するうえで、本領域が持っている有効性や面白さを伝えていきたいと考えている。
保育内容研究（造形表現）１,2017,第3クォーター,3H114,幼児教育における造形表現活動について、理論と実践を交えて学びます。
情報リテラシー演習２,2017,第4クォーター,4H037,オンラインコミュニケーション・表計算に関わる応用的な操作方法ならびにデスクトッププレゼンテーションに関わる基本的な操作方法を身に付け、情報機器の高度な活用技能を習得する。
社会教育計画論２,2017,第4クォーター,4H080,さまざまな社会的課題の解決をめざす社会教育のあり方、精神、方法を理解する。
運動とこころの科学２,2017,第4クォーター,4H085,＊「１.」と同じテーマを異なるトピックスからアプローチする．欧米での、運動やスポーツに関する心理学の名称は「Exercise and Sport Psychology」で、一般人の健康スポーツを対象とした運動心理学と競技スポーツを対象としたスポーツ心理学を区別している。また学校体育の問題を扱う体育心理学、身体動作の習得や表現をテーマにした運動学習など、その内容は多岐に渡っている。そこで本講義では狭義の運動心理学だけではなく、幅広く「運動することと心の関係」について様々なテーマから解説する。単に運動やスポーツに関することだけでなく、人間を理解するうえで、本領域が持っている有効性や面白さを伝えていきたいと考えている。
保育内容研究（造形表現）２,2017,第4クォーター,4H114,幼児教育における造形表現活動について、理論と実践を交えて学びます。
教師入門１,2017,第3クォーター,3H112,本講義では、教育基本法、学校教育法、児童福祉法、幼稚園教育要領、保育所保育指針などを踏まえ、乳幼児教育における教師・保育者の職務の意義、役割、倫理、制度的位置づけについて学ぶ。
教師入門２,2017,第4クォーター,4H112,本講義では、乳幼児教育における教師・保育者の職務とその意義を踏まえ、小学校や専門機関との連携・協働、専門性の発達とキャリア形成について学ぶ。
教職論（小）１,2017,第1クォーター,1H106,教職の現代史（戦後史）の学習を通じ、今後の教職のあり方を展望する。教職の意義と教員の役割、教員の職務内容（研修、服務、身分保障等を含む）の中核として教科指導・生活指導、職場の人間関係、保護者や地域社会との関係など、子どもをめぐる環境の変化と教師のしごとの変化に関する諸問題の検討を通じ、その時々を戦後日本の教師たちはどのように生きてきたのかを考える。
教職論（小）２,2017,第2クォーター,2H106,「教職論１」で学習した教職の現代史的理解を踏まえて、教職の意義と教員の役割、教員の職務内容（研修、服務、身分保障等を含む）の中核としての教科指導と生活指導、職場の人間関係、保護者や地域社会との関係など、子どもをめぐる環境の変化に伴う教師のしごとの変化に関する諸問題の検討を通じ、教職の現在を理解し、未来を展望する。
からだの構造と機能１,2017,第3クォーター,3H082,この授業のテーマは、人体に関する「解剖学」と「生理学」である。
人とアート論１,2017,第3クォーター,3H088,芸術の創造と解釈
教育経営学（幼・小）１,2017,第3クォーター,3H108,本講義では教育経営学の立場から、複雑化・加速化する教育課題を踏まえ、教育の理想の実現をめぐる諸条件（社会的要請や資源制約等）を「現実的」に考え、目的設定・共有から実施・評価・改善に至る展開過程や、その実現を左右する人々の協働関係等を可能な限り「動態的」に把握・構築・実践する力量の基礎を培う。
保育内容研究（児童文化と言葉）１,2017,第3クォーター,3H116,この授業では、幼稚園教育要領の領域「言葉」について、乳幼児期の言語発達を踏まえながら、乳幼児のコミュニケーションや児童文化を通した言葉の習得の指導法について講義する。
第二言語習得論２,2017,第4クォーター,4H063,第二言語習得論では，第一言語（母語）ではない言語（第二言語，外国語）を私たちがどのような過程を経て習得・学習するのか，またその学習・習得にはどのような要因が関わるのかを扱います．この授業では第二言語習得論が成立した背景を取り上げるとともに，第二言語習得の代表的な理論を概観します．特に英語を外国語（あるいは第二言語）とする人たちが英語を習得する際に関係する言語学的，認知心理学的な要因と英語習得のプロセスについて取り上げます．
からだの構造と機能２,2017,第4クォーター,4H082,この授業のテーマは、人体に関する「解剖学」と「生理学」である。
人とアート論２,2017,第4クォーター,4H088,人とアートの関わりとその歴史
教育経営学（幼・小）２,2017,第4クォーター,4H108,本講義では教育経営学の立場から、特に学校と地域等との関係構築に関する知見の習得を目指す。特定の教育理念の実現を目指し、社会に渦巻く様々な人・諸機関・資源（社会的諸力）を組織化し、効果的に運用・活用する営みという側面から教育経営をとらえ、教職の充実・発展に資することを目指す。
保育内容研究（児童文化と言葉）２,2017,第4クォーター,4H116,この授業では、幼稚園教育要領の領域「言葉」について、乳幼児期の言語発達を踏まえながら、乳幼児のコミュニケーションや児童文化を通した言葉の習得の指導法について講義する。
教育行政学（中・高）１,2017,第1クォーター,1H204,日本の教育行政を全体的に理解した上で，「教育改革」というテーマにおいてどのような社会的・制度的・経営的事項が生じ，また営まれているのかを知る。
教育行政学（中・高）２,2017,第2クォーター,2H204,日本の教育行政を全体的に理解した上で，「教育改革」というテーマにおいてどのような社会的・制度的・経営的事項が生じ，また営まれているのかを知る。
日本社会文化論Ａ,2017,第1クォーター,1H055,文化交流に焦点をあてながら、日本学とはなにかを講義
文化人類学１,2017,第1クォーター,1H059,グローバル化や国際化の加速度的な進展とともに、地球上のすべての社会を取り巻く文化的環境は大きく変化している。それに伴い、文化人類学では、新しい知の体系を再構築するべく現代的および実践的な問題を積極的に扱うようになった。本授業では、世界の文化や社会の多様性を学ぶとともに、親族や儀礼などのほか開発、観光、紛争といった現代的な諸テーマを取り上げる。
日本社会文化論Ｂ,2017,第2クォーター,2H055,【第1クォーターの「日本社会文化論A」とあわせて履修することがのぞましい】文化交流に焦点をあてながら、日本学とはなにかを講義
文化人類学２,2017,第2クォーター,2H059,グローバル化や国際化の加速度的な進展とともに、地球上のすべての社会を取り巻く文化的環境は大きく変化している。それに伴い、文化人類学では、新しい知の体系を再構築するべく現代的および実践的な問題を積極的に扱うようになった。本授業では、世界の文化や社会の多様性を学ぶとともに、親族や儀礼などのほか開発、観光、紛争といった現代的な諸テーマを取り上げる。
